[
{
  "rule_id": "NEC-TAIYANG-WUHAN",
  "proposition": "太阳病 ⇒ 恶寒",
  "object": "太阳病之归属判定",
  "scope": {"kind": "cross_scenario"},
  "antecedent": [{"observation": "恶寒", "required_state": "absent_explicit"}],
  "rule_effect": "exclude",
  "effect": "排除太阳（全类）",
  "validation_status": "falsified_overbroad",
  "source_author": "胡希恕",
  "source_layer": "L4_hu_theory",
  "speaker_status": "hu_direct",
  "source_refs": ["讲伤寒·196476", "C卷·9759", "讲伤寒·116589", "C卷·7875(§3)"],
  "counterexamples": [
    {"ref": "讲伤寒·188178(§172)",
     "note": "「太阳与少阳合病者，那么就指有太阳病的证候，这个太阳病的证候也不过是脉浮，发热而已。它并不恶寒」——太阳成分在场而 absent_explicit(恶寒)",
     "effect_on_rule": "falsifies"},
    {"ref": "C卷·125102(§172注解)",
     "note": "⭐同一 §172，胡老另一书之【注解】却作「太阳病之发热恶寒与少阳病之口苦咽干同时出现」——**同条文两读，胡老自身冲突**",
     "effect_on_rule": "disputes"}],
  "text_status": "disputed",
  "compile_status": "inactive",
  "notes": "⛔120批 撤销·用户令一。119批 曾立为 D5 全局硬必要条件并称『本工程第一条完成四条件者』，该说一并撤销。作用对象须拆为 A独立太阳病提纲型／B病例中之太阳成分／C合病并病中之太阳成分——现无任一经反例攻击存活，故 inactive。"
},
{
  "rule_id": "SUP-WUHAN-BIAOYANG",
  "proposition": "恶寒 → 支持 表位/太阳",
  "object": "表位候选",
  "scope": {"kind": "cross_scenario"},
  "antecedent": [{"observation": "恶寒", "required_state": "present"}],
  "rule_effect": "support",
  "effect": "提高表位/太阳候选之后验",
  "validation_status": "source_verified",
  "source_author": "胡希恕",
  "source_layer": "L4_hu_theory",
  "speaker_status": "hu_direct",
  "source_refs": ["讲伤寒·5483", "C卷·7875(§3)"],
  "counterexamples": [],
  "text_status": "accepted",
  "compile_status": "support_only",
  "notes": "⭐这是 NEC-TAIYANG-WUHAN 撤销后【最多可保留者】。恶寒 → supporting_evidence，不得作 exclusion。"
},
{
  "rule_id": "S70-HANHOU-SHI",
  "proposition": "发汗后·不恶寒但热者 ⇒ 里实（阳明）",
  "object": "实纲/阳明里实",
  "scope": {"kind": "stage_conditional",
            "conditions": ["treatment_history.includes(发汗)"],
            "exclusions": ["无发汗史者不适用"]},
  "antecedent": [
    {"observation": "发汗史", "required_state": "present"},
    {"observation": "恶寒", "required_state": "absent_explicit"},
    {"observation": "但热", "required_state": "present"}],
  "rule_effect": "confirm",
  "effect": "里实（阳明）成立，当和胃气",
  "validation_status": "scope_verified",
  "source_author": "胡希恕",
  "source_layer": "L4_hu_theory",
  "speaker_status": "hu_direct",
  "source_refs": ["C卷·71679(§70注解)"],
  "counterexamples": [],
  "text_status": "accepted",
  "compile_status": "active",
  "notes": "⛔120批 恢复病程作用域·用户令七。§70 完整前件含【发汗后】。禁升级为『任何场景：不恶寒+发热→阳明里实』。119批 只改了措辞未锁 scope。"
},
{
  "rule_id": "NEC-LGZG-QICHONG",
  "proposition": "苓桂术甘汤有效 ⇒ 有气冲之候",
  "object": "苓桂术甘汤方证",
  "scope": {"kind": "formula_pattern"},
  "antecedent": [{"observation": "气冲之候", "required_state": "absent_explicit"}],
  "rule_effect": "exclude",
  "effect": "排除苓桂术甘汤",
  "validation_status": "candidate",
  "source_author": "未定",
  "source_layer": "L5_editorial",
  "speaker_status": "uncertain",
  "source_refs": ["传真系·38229"],
  "counterexamples": [
    {"ref": "传真系·38229 之刘某案",
     "note": "耳鸣耳聋头晕、苔白脉沉细，判水饮上犯，本方有效，而记载中六项气冲之候一项未见。⛔但『未载』是 unknown_not_recorded 不是 absent_explicit，故【不构成反例】",
     "effect_on_rule": "none"}],
  "text_status": "unresolved",
  "compile_status": "fail_closed",
  "notes": "⛔卡在【说话主体未定】：该句在【临床应用】栏，而〔传真·前言〕只界定了【注解】【按】【解读】三栏。speaker_status=uncertain ⇒ fail closed。气冲之候可观察枚举：心下逆满/气上冲咽喉/心下痞硬/胁下痛/气上冲胸/胸胁支满/起则头眩/身为振振摇。"
},
{
  "rule_id": "JUEYIN-SHANGREXIAHAN",
  "proposition": "厥阴 ⇒ 上热下寒",
  "object": "厥阴之判定",
  "scope": {"kind": "cross_scenario"},
  "antecedent": [{"observation": "上热下寒", "required_state": "absent_explicit"}],
  "rule_effect": "exclude",
  "effect": "排除厥阴",
  "validation_status": "disputed",
  "source_author": "冯世纶等",
  "source_layer": "L5_editorial",
  "speaker_status": "editorial",
  "source_refs": ["解读·261497"],
  "counterexamples": [
    {"ref": "C卷·12662",
     "note": "胡老结构层：「凡阴证除外表里者，当然即属半表半里的阴证」；同段并云厥阴之提法『更成问题』、『不可专凭提纲为依据』",
     "effect_on_rule": "falsifies"}],
  "revision_relation": "L5 强化自 L4；L5 不得覆盖 L4",
  "text_status": "disputed",
  "compile_status": "inactive",
  "notes": "⛔119批 已改版本化，本批入 IR 并锁 inactive。上热下寒只可作 support，不得作 exclusion。"
}
]
